place_id,name,link,main_category,categories,rating,reviews,address
ChIJq95xT4I30i0RaU3j93Diq8o,Tanah Lot,https://www.google.com/maps/place/Tanah+Lot/data=!4m7!3m6!1s0x2dd237824f71deab:0xcaabe270f7e34d69!8m2!3d-8.621213!4d115.086807!16zL20vMGJ2NGRo!19sChIJq95xT4I30i0RaU3j93Diq8o?authuser=0&hl=id&rclk=1,Titik Pemandangan,"Titik Pemandangan, Tujuan Wisata",4.6,89734,"Tanah Lot, Beraban, Kec. Kediri, Kabupaten Tabanan, Bali 82121"
ChIJx97hVM9E0i0RUVpPBj5miBk,Taman Budaya Garuda Wisnu Kencana,https://www.google.com/maps/place/Taman+Budaya+Garuda+Wisnu+Kencana/data=!4m7!3m6!1s0x2dd244cf54e1dec7:0x1988663e064f5a51!8m2!3d-8.8104228!4d115.1675986!16zL20vMGRyenpx!19sChIJx97hVM9E0i0RUVpPBj5miBk?authuser=0&hl=id&rclk=1,Taman,"Taman, Tujuan Wisata",4.5,59929,"Taman Budaya Garuda Wisnu Kencana, Jl. Raya Uluwatu, Ungasan, Kec. Kuta Sel., Kabupaten Badung, Bali 80364"
ChIJZ5sY9kM90i0RVsPvSxZD7LY,Mandala Suci Wenara Wana,https://www.google.com/maps/place/Mandala+Suci+Wenara+Wana/data=!4m7!3m6!1s0x2dd23d43f6189b67:0xb6ec43164befc356!8m2!3d-8.5193727!4d115.2606299!16s%2Fm%2F03wc0td!19sChIJZ5sY9kM90i0RVsPvSxZD7LY?authuser=0&hl=id&rclk=1,Cagar Alam,"Cagar Alam, Tujuan Wisata",4.5,46132,"Mandala Suci Wenara Wana, Jl. Monkey Forest, Ubud, Kecamatan Ubud, Kabupaten Gianyar, Bali 80571"
ChIJbZgU8gRb0i0RmWRatK3bd3I,Pantai Pandawa,https://www.google.com/maps/place/Pantai+Pandawa/data=!4m7!3m6!1s0x2dd25b04f214986d:0x7277dbadb45a6499!8m2!3d-8.8454504!4d115.1866116!16s%2Fg%2F12q4w015p!19sChIJbZgU8gRb0i0RmWRatK3bd3I?authuser=0&hl=id&rclk=1,Tujuan Wisata,"Tujuan Wisata, Penyelenggara aktivitas luar ruangan, Pusat Informasi Pariwisata",4.6,42116,"553P+R5G Pantai Pandawa, Jl. Pantai Pandawa, Kutuh, Kec. Kuta Sel., Kabupaten Badung, Bali 80361"
ChIJVwisn2yJ0S0RUxvb5GhlJBg,Pura Ulun Danu Beratan Bedugul,https://www.google.com/maps/place/Pura+Ulun+Danu+Beratan+Bedugul/data=!4m7!3m6!1s0x2dd1896c9fac0857:0x18246568e4db1b53!8m2!3d-8.2751807!4d115.1668234!16s%2Fm%2F05zyg1h!19sChIJVwisn2yJ0S0RUxvb5GhlJBg?authuser=0&hl=id&rclk=1,Pura,"Pura, Tujuan Wisata",4.6,38810,"Pura Ulun Danu Beratan Bedugul, Danau Beratan, Candikuning, Kec. Baturiti, Kabupaten Tabanan, Bali 82191"
ChIJ0Zo39DZH0i0R0acI0bADr2U,Tirta Gangga,https://www.google.com/maps/place/Tirta+Gangga/data=!4m7!3m6!1s0x2dd24736f4379ad1:0x65af03b0d108a7d1!8m2!3d-8.4123473!4d115.5872919!16s%2Fm%2F09rv951!19sChIJ0Zo39DZH0i0R0acI0bADr2U?authuser=0&hl=id&rclk=1,Tujuan Wisata,Tujuan Wisata,4.6,17513,"HHQQ+836 Tirta Gangga, Jalan Raya Abang Desa Adat Jl. Raya Tirta Gangga, Ababi, Kec. Abang, Kabupaten Karangasem, Bali 80852"
ChIJE4Bi4H4i0i0R83X6AGpQQ_Q,Alas Harum Bali,https://www.google.com/maps/place/Alas+Harum+Bali/data=!4m7!3m6!1s0x2dd2227ee0628013:0xf443506a00fa75f3!8m2!3d-8.43989!4d115.2806075!16s%2Fg%2F11cjj0wf3v!19sChIJE4Bi4H4i0i0R83X6AGpQQ_Q?authuser=0&hl=id&rclk=1,Tujuan Wisata,"Tujuan Wisata, Olahraga Petualangan, Kedai Kopi, Pusat Rekreasi, Restoran, Restoran Vegetarian",4.5,11824,"Alas Harum Bali, Jl. Raya Tegallalang, Tegallalang, Kec. Tegallalang, Kabupaten Gianyar, Bali 80561"
ChIJL1XuIURB0i0RNRhRbMMJMLI,Upside Down World Bali,https://www.google.com/maps/place/Upside+Down+World+Bali/data=!4m7!3m6!1s0x2dd2414421ee552f:0xb23009c36c511835!8m2!3d-8.716711!4d115.2052612!16s%2Fg%2F11cl_3yx00!19sChIJL1XuIURB0i0RNRhRbMMJMLI?authuser=0&hl=id&rclk=1,Tujuan Wisata,Tujuan Wisata,4.2,3846,"Upside Down World Bali, Jl. Bypass Ngurah Rai No.762, Pemogan, Denpasar Selatan, Kota Denpasar, Bali 80221"
ChIJaUlA7-UI0i0RMYGksT4bx8s,Bukit Asah Desa Bugbug,https://www.google.com/maps/place/Bukit+Asah+Desa+Bugbug/data=!4m7!3m6!1s0x2dd208e5ef404969:0xcbc71b3eb1a48131!8m2!3d-8.505565!4d115.6105888!16s%2Fg%2F11cnddsz4y!19sChIJaUlA7-UI0i0RMYGksT4bx8s?authuser=0&hl=id&rclk=1,Tujuan Wisata,Tujuan Wisata,4.6,1774,"FJV6+Q6G Bukit Asah Desa Bugbug, Desa Adat Bugbug, Sengkidu, Kec. Manggis, Kabupaten Karangasem, Bali"
ChIJAzxT71kf0i0RdZJCraQLT14,Lembah Bidadari,https://www.google.com/maps/place/Lembah+Bidadari/data=!4m7!3m6!1s0x2dd21f59ef533c03:0x5e4f0ba4ad429275!8m2!3d-8.3925533!4d115.2880366!16s%2Fg%2F11fx8c2lwk!19sChIJAzxT71kf0i0RdZJCraQLT14?authuser=0&hl=id&rclk=1,Tujuan Wisata,Tujuan Wisata,4.3,188,"Lembah Bidadari, Sangaji, Taro, Kec. Tegallalang, Kabupaten Gianyar, Bali 80561"
ChIJk_WRf7ZE0i0RdIV8-CQfBlc,Plaza Garuda,https://www.google.com/maps/place/Plaza+Garuda/data=!4m7!3m6!1s0x2dd244b67f91f593:0x57061f24f87c8574!8m2!3d-8.8102751!4d115.1681446!16s%2Fg%2F11hcflgbnb!19sChIJk_WRf7ZE0i0RdIV8-CQfBlc?authuser=0&hl=id&rclk=1,Tujuan Wisata,"Tujuan Wisata, Pematung",4.5,74,"Plaza Garuda, Jl. Raya Uluwatu, Ungasan, Kec. Kuta Sel., Kabupaten Badung, Bali 80361"
ChIJkbJrRYFH0i0RggJb7CncdHE,Pantai Kuta Bali,https://www.google.com/maps/place/Pantai+Kuta+Bali/data=!4m7!3m6!1s0x2dd24781456bb291:0x7174dc29ec5b0282!8m2!3d-8.7127552!4d115.1668777!16s%2Fg%2F11cjhzvk9x!19sChIJkbJrRYFH0i0RggJb7CncdHE?authuser=0&hl=id&rclk=1,Tujuan Wisata,"Tujuan Wisata, Taman",4.6,15975,"Pantai Kuta Bali, Jl. Pantai Kuta No.32, Legian, Badung, Kabupaten Badung, Bali"
ChIJmRTfT9ZC0i0RRB_NXwb5P2k,Waterblow,https://www.google.com/maps/place/Waterblow/data=!4m7!3m6!1s0x2dd242d64fdf1499:0x693ff9065fcd1f44!8m2!3d-8.8038567!4d115.2398639!16s%2Fg%2F11b66sm7gm!19sChIJmRTfT9ZC0i0RRB_NXwb5P2k?authuser=0&hl=id&rclk=1,Tujuan Wisata,"Tujuan Wisata, Taman",4.4,9120,"Waterblow, Benoa, Kec. Kuta Sel., Kabupaten Badung, Bali 80363"
ChIJ3Urujw9E0i0RWSEmcOlT2sg,Patung Satria Gatot Kaca,https://www.google.com/maps/place/Patung+Satria+Gatot+Kaca/data=!4m7!3m6!1s0x2dd2440f8fee4add:0xc8da53e970262159!8m2!3d-8.7443882!4d115.1788673!16s%2Fg%2F11btvb72pd!19sChIJ3Urujw9E0i0RWSEmcOlT2sg?authuser=0&hl=id&rclk=1,Monumen,"Monumen, Taman, Tujuan Wisata",4.6,3996,"Patung Satria Gatot Kaca, Jl. Raya Tuban No.1, Tuban, Kec. Kuta, Kabupaten Badung, Bali 80361"
ChIJYyHbhgia0S0RzdjNXLmcf54,Kawasan Wisata Ex. Pelabuhan Buleleng,https://www.google.com/maps/place/Kawasan+Wisata+Ex.+Pelabuhan+Buleleng/data=!4m7!3m6!1s0x2dd19a0886db2163:0x9e7f9cb95ccdd8cd!8m2!3d-8.1039305!4d115.0900307!16s%2Fg%2F1hm3k_rbs!19sChIJYyHbhgia0S0RzdjNXLmcf54?authuser=0&hl=id&rclk=1,Tujuan Wisata,"Tujuan Wisata, Restoran",4.3,2760,"Kawasan Wisata Ex. Pelabuhan Buleleng, Jl. Pelabuhan Buleleng, Kp. Bugis, Kec. Buleleng, Kabupaten Buleleng, Bali 81113"
ChIJQWvBDkoj0i0RLYVMkHhMqGw,Taman Mumbul Sangeh,https://www.google.com/maps/place/Taman+Mumbul+Sangeh/data=!4m7!3m6!1s0x2dd2234a0ec16b41:0x6ca84c78904c852d!8m2!3d-8.4844737!4d115.2121809!16s%2Fg%2F11b728qrhs!19sChIJQWvBDkoj0i0RLYVMkHhMqGw?authuser=0&hl=id&rclk=1,Tujuan Wisata,Tujuan Wisata,4.6,2335,"Taman Mumbul Sangeh, Jln.brahmana No.38, Sangeh, Kec. Abiansemal, Kabupaten Badung, Bali 80352"
ChIJjThliIs_0i0RgHRCA1uUUBI,Desa Budaya Kertalangu,https://www.google.com/maps/place/Desa+Budaya+Kertalangu/data=!4m7!3m6!1s0x2dd23f8b8865388d:0x1250945b03427480!8m2!3d-8.6441734!4d115.2553513!16s%2Fg%2F1pxwgx_2j!19sChIJjThliIs_0i0RgHRCA1uUUBI?authuser=0&hl=id&rclk=1,Wisata,"Wisata, Tujuan Wisata",4.3,2228,"Desa Budaya Kertalangu, Jl. Bypass Ngurah Rai No.88, Kesiman Kertalangu, Kec. Denpasar Tim., Kota Denpasar, Bali 80237"
ChIJA-LqptiO0S0RvoHMiW8mfAE,Puncak Wanagiri,https://www.google.com/maps/place/Puncak+Wanagiri/data=!4m7!3m6!1s0x2dd18ed8a6eae203:0x17c266f89cc81be!8m2!3d-8.2371393!4d115.1417792!16s%2Fg%2F11c75wc8j_!19sChIJA-LqptiO0S0RvoHMiW8mfAE?authuser=0&hl=id&rclk=1,Tujuan Wisata,Tujuan Wisata,4.6,1868,"Puncak Wanagiri, Jl. Raya Wanagiri, Pancasari, Kec. Sukasada, Kabupaten Buleleng, Bali 81161"
ChIJXfZP2tYg0i0RUaM-yoiFiXs,Air Terjun Leke Leke,https://www.google.com/maps/place/Air+Terjun+Leke+Leke/data=!4m7!3m6!1s0x2dd220d6da4ff65d:0x7b898588ca3ea351!8m2!3d-8.3643494!4d115.1973031!16s%2Fg%2F11g8xgmsnk!19sChIJXfZP2tYg0i0RUaM-yoiFiXs?authuser=0&hl=id&rclk=1,Tujuan Wisata,Tujuan Wisata,4.4,1862,"Air Terjun Leke Leke, Kerobokan, Jl. Swadaya, Mekarsari, Kec. Baturiti, Kabupaten Tabanan, Bali 82191"
ChIJNa4uW0xB0i0RevpSX7uEVjQ,Barong Tanah Kilap - Sari Wisata Budaya BALI,https://www.google.com/maps/place/Barong+Tanah+Kilap+-+Sari+Wisata+Budaya+BALI/data=!4m7!3m6!1s0x2dd2414c5b2eae35:0x345684bb5f52fa7a!8m2!3d-8.718854!4d115.1924122!16s%2Fg%2F11clyszkc2!19sChIJNa4uW0xB0i0RevpSX7uEVjQ?authuser=0&hl=id&rclk=1,Tujuan Wisata,Tujuan Wisata,4.4,1786,"Barong Tanah Kilap - Sari Wisata Budaya BALI, Jl. Griya Anyar No.25B, Pemogan, Denpasar Selatan, Kota Denpasar, Bali 80221"
ChIJL-o1GhJA0i0R5Abv31St2ck,"Taman Bali, Padang Galak","https://www.google.com/maps/place/Taman+Bali,+Padang+Galak/data=!4m7!3m6!1s0x2dd240121a35ea2f:0xc9d9ad54dfef06e4!8m2!3d-8.6575124!4d115.2654034!16s%2Fg%2F11b7xgwr4q!19sChIJL-o1GhJA0i0R5Abv31St2ck?authuser=0&hl=id&rclk=1",Kota Hantu,"Kota Hantu, Taman, Tujuan Wisata",4.4,1640,"Taman Bali, Padang Galak, Jl. Padang Galak No.3, Kesiman, Kec. Denpasar Tim., Kota Denpasar, Bali"
ChIJhTrb3ZlB0i0RloULjHV5Yfc,Taman Inspirasi Mertasari,https://www.google.com/maps/place/Taman+Inspirasi+Mertasari/data=!4m7!3m6!1s0x2dd24199dddb3a85:0xf76179758c0b8596!8m2!3d-8.7120008!4d115.24822!16s%2Fg%2F11cjj306q7!19sChIJhTrb3ZlB0i0RloULjHV5Yfc?authuser=0&hl=id&rclk=1,Tujuan Wisata,"Tujuan Wisata, Taman, Taman bermain",4.4,1089,"Taman Inspirasi Mertasari, No., Jl. Pengembak No.44, Denpasar Selatan, Kota Denpasar, Bali"
ChIJu0Dbm3g_0i0ReErLR0BFjww,Tukad BINDU,https://www.google.com/maps/place/Tukad+BINDU/data=!4m7!3m6!1s0x2dd23f789bdb40bb:0xc8f454047cb4a78!8m2!3d-8.6437911!4d115.2358125!16s%2Fg%2F11c6r1t8p0!19sChIJu0Dbm3g_0i0ReErLR0BFjww?authuser=0&hl=id&rclk=1,Taman,"Taman, Tujuan Wisata",4.5,1006,"Tukad BINDU, Jl. Turi, Kesiman, Kec. Denpasar Tim., Kota Denpasar, Bali 80235"
ChIJH74r389c0i0RWSMHR349rSc,Pura Geger Beach,https://www.google.com/maps/place/Pura+Geger+Beach/data=!4m7!3m6!1s0x2dd25ccfdf2bbe1f:0x27ad3d7e47072359!8m2!3d-8.819863!4d115.223829!16s%2Fg%2F11cm_pt96n!19sChIJH74r389c0i0RWSMHR349rSc?authuser=0&hl=id&rclk=1,Tujuan Wisata,"Tujuan Wisata, Pura",4.7,872,"Pura Geger Beach, Benoa, Kec. Kuta Sel., Kabupaten Badung, Bali"
ChIJ-5G51WyJ0S0R3SGp5T1BdlA,Puncak Indah Bedugul,https://www.google.com/maps/place/Puncak+Indah+Bedugul/data=!4m7!3m6!1s0x2dd1896cd5b991fb:0x5076413de5a921dd!8m2!3d-8.2782353!4d115.1653485!16s%2Fg%2F11c48nx2zl!19sChIJ-5G51WyJ0S0R3SGp5T1BdlA?authuser=0&hl=id&rclk=1,Tujuan Wisata,Tujuan Wisata,4.6,691,"Puncak Indah Bedugul, No.2, Candikuning, Baturiti, Tabanan Regency, Bali 82191"
ChIJU-tl2bcm0i0RwNe4LQjhgzQ,DESA WISATA PINGE,https://www.google.com/maps/place/DESA+WISATA+PINGE/data=!4m7!3m6!1s0x2dd226b7d965eb53:0x3483e1082db8d7c0!8m2!3d-8.3903092!4d115.1790329!16s%2Fg%2F11dfxd6h2x!19sChIJU-tl2bcm0i0RwNe4LQjhgzQ?authuser=0&hl=id&rclk=1,Tujuan Wisata,Tujuan Wisata,4.5,238,"J55H+VJF DESA WISATA PINGE, Pinge Baru, Kec. Marga, Kabupaten Tabanan, Bali 82181"
ChIJy7-x3yqd0S0RzMSU3AqIjFU,Pantai Tangguwisia Bali,https://www.google.com/maps/place/Pantai+Tangguwisia+Bali/data=!4m7!3m6!1s0x2dd19d2adfb1bfcb:0x558c880adc94c4cc!8m2!3d-8.1824962!4d114.9492327!16s%2Fg%2F11bv3rh33h!19sChIJy7-x3yqd0S0RzMSU3AqIjFU?authuser=0&hl=id&rclk=1,Area Rekreasi Alam,"Area Rekreasi Alam, Tujuan Wisata",4.3,191,"Pantai Tangguwisia Bali, Tangguwisia, Kec. Seririt, Kabupaten Buleleng, Bali 81152"
ChIJrz7gBh5H0i0R0oOF7m3zaEA,Pantai Mesari,https://www.google.com/maps/place/Pantai+Mesari/data=!4m7!3m6!1s0x2dd2471e06e03eaf:0x4068f36dee8583d2!8m2!3d-8.6940298!4d115.1594615!16s%2Fg%2F11cjj16svn!19sChIJrz7gBh5H0i0R0oOF7m3zaEA?authuser=0&hl=id&rclk=1,Tujuan Wisata,Tujuan Wisata,4.7,130,"Pantai Mesari, Jl. Camplung Tanduk, Seminyak, Kec. Kuta, Kabupaten Badung, Bali"
ChIJGTjbCdxB0i0RUG8eRve1SII,Taman Kumbasari,https://www.google.com/maps/place/Taman+Kumbasari/data=!4m7!3m6!1s0x2dd241dc09db3819:0x8248b5f7461e6f50!8m2!3d-8.6563222!4d115.2118701!16s%2Fg%2F11g0gbcqvz!19sChIJGTjbCdxB0i0RUG8eRve1SII?authuser=0&hl=id&rclk=1,Taman,"Taman, Tujuan Wisata",4.4,102,"86V6+FPH Taman Kumbasari, Jl. Ps. Kumbasari, Pemecutan, Kec. Denpasar Bar., Kota Denpasar, Bali"
ChIJDyEC4IxA0i0RLg6iSxg01mw,Oky Bali Trekking - Mount Batur Hike,https://www.google.com/maps/place/Oky+Bali+Trekking+-+Mount+Batur+Hike/data=!4m7!3m6!1s0x2dd2408ce002210f:0x6cd634184ba20e2e!8m2!3d-8.6688197!4d115.2276698!16s%2Fg%2F11bwyqvpgw!19sChIJDyEC4IxA0i0RLg6iSxg01mw?authuser=0&hl=id&rclk=1,Tujuan Wisata,Tujuan Wisata,5,2,"Oky Bali Trekking - Mount Batur Hike, jalan tukad ijo Gading Gang II no 3 oanjer, Dangin Puri Klod, Kec. Denpasar Tim., Kota Denpasar, Bali 80234"
