place_id,name,link,main_category,categories,rating,reviews,address
ChIJEyzN0y2HeC4ROB080owDlTI,Museum Angkut,https://www.google.com/maps/place/Museum+Angkut/data=!4m7!3m6!1s0x2e78872dd3cd2c13:0x3295038cd23c1d38!8m2!3d-7.878809!4d112.5199747!16s%2Fg%2F11clyt6fly!19sChIJEyzN0y2HeC4ROB080owDlTI?authuser=0&hl=id&rclk=1,Museum,"Museum, Museum Seni, Museum Seni Modern, Tujuan Wisata",4.7,54103,"Museum Angkut, Jl. Terusan Sultan Agung No.2, Ngaglik, Kec. Batu, Kota Batu, Jawa Timur 65314"
ChIJh5QNLnZ-eC4RQCvB8atMgLg,Taman Rekreasi Selecta,https://www.google.com/maps/place/Taman+Rekreasi+Selecta/data=!4m7!3m6!1s0x2e787e762e0d9487:0xb8804cabf1c12b40!8m2!3d-7.8183031!4d112.5253337!16s%2Fg%2F11b7rnf310!19sChIJh5QNLnZ-eC4RQCvB8atMgLg?authuser=0&hl=id&rclk=1,Taman Hiburan,"Taman Hiburan, Taman, Tujuan Wisata",4.5,37384,"Taman Rekreasi Selecta, Jl. Raya Selecta No.1, Tulungrejo, Kec. Bumiaji, Kota Batu, Jawa Timur 65336"
ChIJ23IsPzCBeC4RIex3GhfXPpU,Batu Night Spectacular,https://www.google.com/maps/place/Batu+Night+Spectacular/data=!4m7!3m6!1s0x2e7881303f2c72db:0x953ed7171a77ec21!8m2!3d-7.8965273!4d112.5345306!16s%2Fg%2F11cs693vbv!19sChIJ23IsPzCBeC4RIex3GhfXPpU?authuser=0&hl=id&rclk=1,Taman Hiburan,"Taman Hiburan, Tujuan Wisata",4.5,35696,"Batu Night Spectacular, Jl. Hayam Wuruk No.1, Oro-Oro Ombo, Kec. Batu, Kota Batu, Jawa Timur 65316"
ChIJ26tkv1H81y0RX300Hu4mVEU,Danau Unesa Lidah Wetan,https://www.google.com/maps/place/Danau+Unesa+Lidah+Wetan/data=!4m7!3m6!1s0x2dd7fc51bf64abdb:0x455426ee1e347d5f!8m2!3d-7.3014893!4d112.6749246!16s%2Fg%2F11c60jpp5v!19sChIJ26tkv1H81y0RX300Hu4mVEU?authuser=0&hl=id&rclk=1,Tujuan Wisata,"Tujuan Wisata, Taman",4.5,6441,"Danau Unesa Lidah Wetan, Jl. Raya Kampus Unesa, Lidah Wetan, Kec. Lakarsantri, Surabaya, Jawa Timur 60213"
ChIJq6qqqo-HeC4R_k3K1zyP5Us,Desa Wisata Pujonkidul,https://www.google.com/maps/place/Desa+Wisata+Pujonkidul/data=!4m7!3m6!1s0x2e78878faaaaaaab:0x4be58f3cd7ca4dfe!8m2!3d-7.8557059!4d112.4558603!16s%2Fg%2F11f2w5s8vq!19sChIJq6qqqo-HeC4R_k3K1zyP5Us?authuser=0&hl=id&rclk=1,Tujuan Wisata,Tujuan Wisata,4.5,6159,"Desa Wisata Pujonkidul, Pujon Kidul, Pujon, Krajan, Pujon Kidul, Kec. Pujon, Kabupaten Malang, Jawa Timur 65391"
ChIJvb9-F3r61y0RVR3qOPYmyJQ,Taman Harmoni,https://www.google.com/maps/place/Taman+Harmoni/data=!4m7!3m6!1s0x2dd7fa7a177ebfbd:0x94c826f638ea1d55!8m2!3d-7.2952211!4d112.8035603!16s%2Fg%2F11cjj1kf5k!19sChIJvb9-F3r61y0RVR3qOPYmyJQ?authuser=0&hl=id&rclk=1,Taman Kota,"Taman Kota, Taman, Tujuan Wisata",4.5,3909,"Taman Harmoni, Jl. Keputih Tegal Tim. II No.249, Keputih, Kec. Sukolilo, Surabaya, Jawa Timur 60111"
ChIJX4QzLp771y0R2veUXeQJVEU,Taman Mayangkara,https://www.google.com/maps/place/Taman+Mayangkara/data=!4m7!3m6!1s0x2dd7fb9e2e33845f:0x455409e45d94f7da!8m2!3d-7.3069994!4d112.7355235!16s%2Fg%2F11g6mdhl44!19sChIJX4QzLp771y0R2veUXeQJVEU?authuser=0&hl=id&rclk=1,Taman Kota,"Taman Kota, Taman, Tujuan Wisata",4.5,150,"MPVP+662 Taman Mayangkara, Wonokromo, Kec. Wonokromo, Surabaya, Jawa Timur 60243"
ChIJoXixNGH51y0RSpIJQBU1oD4,Wisata Air Taman Prestasi,https://www.google.com/maps/place/Wisata+Air+Taman+Prestasi/data=!4m7!3m6!1s0x2dd7f96134b178a1:0x3ea035154009924a!8m2!3d-7.2618767!4d112.7432029!16s%2Fg%2F11f0kr9tz8!19sChIJoXixNGH51y0RSpIJQBU1oD4?authuser=0&hl=id&rclk=1,Tujuan Wisata,Tujuan Wisata,4.7,131,"Wisata Air Taman Prestasi, Jl. Ketabang Kali No.2-B, Ketabang, Kec. Genteng, Surabaya, Jawa Timur 60272"
ChIJjSU3GL771y0RP1aWZQsG5G0,Taman Bungkul,https://www.google.com/maps/place/Taman+Bungkul/data=!4m7!3m6!1s0x2dd7fbbe1837258d:0x6de4060b6596563f!8m2!3d-7.2913468!4d112.7398218!16s%2Fg%2F121_bvsv!19sChIJjSU3GL771y0RP1aWZQsG5G0?authuser=0&hl=id&rclk=1,Taman Kota,"Taman Kota, Taman, Tujuan Wisata",4.6,55315,"Taman Bungkul, Jl. Taman Bungkul, Darmo, Kec. Wonokromo, Surabaya, Jawa Timur 60241"
ChIJqcwgxR94eC4RWv6VdHLqYJw,Air Terjun Dlundung,https://www.google.com/maps/place/Air+Terjun+Dlundung/data=!4m7!3m6!1s0x2e78781fc520cca9:0x9c60ea727495fe5a!8m2!3d-7.6818774!4d112.5938116!16s%2Fg%2F11b825pbgy!19sChIJqcwgxR94eC4RWv6VdHLqYJw?authuser=0&hl=id&rclk=1,Tujuan Wisata,"Tujuan Wisata, Taman",4.5,7778,"Air Terjun Dlundung, Wisata Dlundung Desa, Hutan, Ketapanrame, Kec. Trawas, Kabupaten Mojokerto, Jawa Timur 61375"
ChIJMa7zEGH51y0Rzj6d9A9drqg,Taman Apsari,https://www.google.com/maps/place/Taman+Apsari/data=!4m7!3m6!1s0x2dd7f96110f3ae31:0xa8ae5d0ff49d3ece!8m2!3d-7.2637501!4d112.7428529!16s%2Fg%2F11csqvx0mp!19sChIJMa7zEGH51y0Rzj6d9A9drqg?authuser=0&hl=id&rclk=1,Taman,"Taman, Tujuan Wisata",4.6,7372,"Taman Apsari, Jl. Taman Apsari No.63, Embong Kaliasin, Kec. Genteng, Surabaya, Jawa Timur 60271"
ChIJ_2f122n71y0RPZtTsCfbkyk,Taman Pelangi,https://www.google.com/maps/place/Taman+Pelangi/data=!4m7!3m6!1s0x2dd7fb69dbf567ff:0x2993db27b0539b3d!8m2!3d-7.3275604!4d112.7312242!16s%2Fg%2F11b721z8jg!19sChIJ_2f122n71y0RPZtTsCfbkyk?authuser=0&hl=id&rclk=1,Taman Kota,"Taman Kota, Taman, Tujuan Wisata",4.5,6542,"Taman Pelangi, Jl. Ahmad Yani No.138, Gayungan, Kec. Gayungan, Surabaya, Jawa Timur 60235"
ChIJRWscw0_h1y0RrtS4lCQa3HY,Taman Abhirama Sidoarjo,https://www.google.com/maps/place/Taman+Abhirama+Sidoarjo/data=!4m7!3m6!1s0x2dd7e14fc31c6b45:0x76dc1a2494b8d4ae!8m2!3d-7.440249!4d112.705097!16s%2Fg%2F11clyfsls5!19sChIJRWscw0_h1y0RrtS4lCQa3HY?authuser=0&hl=id&rclk=1,Taman,"Taman, Tujuan Wisata",4.4,5942,"Taman Abhirama Sidoarjo, Pondokjati, Pagerwojo, Kec. Buduran, Kabupaten Sidoarjo, Jawa Timur 61252"
ChIJm65_0wD51y0RR9_wOsHde2M,Hutan Bambu Keputih Surabaya,https://www.google.com/maps/place/Hutan+Bambu+Keputih+Surabaya/data=!4m7!3m6!1s0x2dd7f900d37fae9b:0x637bddc13af0df47!8m2!3d-7.2941909!4d112.8017238!16s%2Fg%2F11b7rtm8fv!19sChIJm65_0wD51y0RR9_wOsHde2M?authuser=0&hl=id&rclk=1,Tujuan Wisata,"Tujuan Wisata, Taman",4.3,5768,"PR42+8MH Hutan Bambu Keputih Surabaya, Jl. Raya Marina Asri, Keputih, Kec. Sukolilo, Surabaya, Jawa Timur 60111"
ChIJRz0TbAj51y0R0vlX4uzW_GA,Kawasan Wisata Religi Raden Rahmat Sunan Ampel,https://www.google.com/maps/place/Kawasan+Wisata+Religi+Raden+Rahmat+Sunan+Ampel/data=!4m7!3m6!1s0x2dd7f9086c133d47:0x60fcd6ece257f9d2!8m2!3d-7.2302712!4d112.7451621!16s%2Fg%2F11j0b0xc72!19sChIJRz0TbAj51y0R0vlX4uzW_GA?authuser=0&hl=id&rclk=1,Tempat Religius,"Tempat Religius, Tujuan Wisata",4.8,5371,"Kawasan Wisata Religi Raden Rahmat Sunan Ampel, Jl. Nyamplungan, Ampel, Kec. Semampir, Surabaya, Jawa Timur 60151"
ChIJo6mhkMX51y0RRTy25VVoLMY,Pantai Kenjeran Lama,https://www.google.com/maps/place/Pantai+Kenjeran+Lama/data=!4m7!3m6!1s0x2dd7f9c590a1a9a3:0xc62c6855e5b63c45!8m2!3d-7.23819!4d112.795187!16s%2Fg%2F11bxfm0plv!19sChIJo6mhkMX51y0RRTy25VVoLMY?authuser=0&hl=id&rclk=1,Tujuan Wisata,Tujuan Wisata,4.3,3708,"Pantai Kenjeran Lama, Jl. Pantai Kenjeran No.1-6, Kenjeran, Kec. Bulak, Surabaya, Jawa Timur 60123"
ChIJm9nLC0nf1y0RU65rQjPxsyE,Ranu Manduro,https://www.google.com/maps/place/Ranu+Manduro/data=!4m7!3m6!1s0x2dd7df490bcbd99b:0x21b3f133426bae53!8m2!3d-7.572163!4d112.6485746!16s%2Fg%2F11j37djmd1!19sChIJm9nLC0nf1y0RU65rQjPxsyE?authuser=0&hl=id&rclk=1,Tujuan Wisata,Tujuan Wisata,4.3,1861,"Ranu Manduro, Mandurono, Watesnegoro, Kec. Ngoro, Kabupaten Mojokerto, Jawa Timur 61385"
ChIJ5dU8f6f61y0Ryfz1SZ28eyo,Kebun Raya Mangrove Surabaya,https://www.google.com/maps/place/Kebun+Raya+Mangrove+Surabaya/data=!4m7!3m6!1s0x2dd7faa77f3cd5e5:0x2a7bbc9d49f5fcc9!8m2!3d-7.3308016!4d112.8156243!16s%2Fg%2F1hm5n6x38!19sChIJ5dU8f6f61y0Ryfz1SZ28eyo?authuser=0&hl=id&rclk=1,Kebun Raya,"Kebun Raya, Taman, Tujuan Wisata",4.3,1574,"MR98+M6H Kebun Raya Mangrove Surabaya, Jalan Medokan Sawah Timur Segoro Tambak Sedati, Medokan Ayu, Kec. Rungkut, Surabaya, Jawa Timur 60295"
ChIJbzk5Pm3e1y0R2EO9nJETCvs,Taman Dwarakerta,https://www.google.com/maps/place/Taman+Dwarakerta/data=!4m7!3m6!1s0x2dd7de6d3e39396f:0xfb0a13919cbd43d8!8m2!3d-7.533633!4d112.7012887!16s%2Fg%2F11cls81lrv!19sChIJbzk5Pm3e1y0R2EO9nJETCvs?authuser=0&hl=id&rclk=1,Taman,"Taman, Tujuan Wisata",4.3,627,"Taman Dwarakerta, Jalan Nasional 1 Porong, Jatirejo, Sidoarjo, Kabupaten Sidoarjo, Jawa Timur 61274"
ChIJkUcKRpbl1y0RFNwjOy2VgWo,Candi Tawangalun,https://www.google.com/maps/place/Candi+Tawangalun/data=!4m7!3m6!1s0x2dd7e596460a4791:0x6a81952d3b23dc14!8m2!3d-7.3988428!4d112.7891594!16s%2Fg%2F11b7rf0qqw!19sChIJkUcKRpbl1y0RFNwjOy2VgWo?authuser=0&hl=id&rclk=1,Pura,"Pura, Bangunan Bersejarah, Tujuan Wisata",4.2,310,"Candi Tawangalun, Jalan Tawang Alun, Buncitan, Sedati, Dusun Kp. Baru, Buncitan, Kec. Sidoarjo, Kabupaten Sidoarjo, Jawa Timur 61253"
ChIJhTWYlD7e1y0R6sDCUtRM8mY,Candi Pamotan 2,https://www.google.com/maps/place/Candi+Pamotan+2/data=!4m7!3m6!1s0x2dd7de3e94983585:0x66f24cd452c2c0ea!8m2!3d-7.5278242!4d112.6868078!16s%2Fg%2F11b7rf5lgm!19sChIJhTWYlD7e1y0R6sDCUtRM8mY?authuser=0&hl=id&rclk=1,Bangunan Bersejarah,"Bangunan Bersejarah, Tujuan Wisata",4.1,308,"FMCP+VPF Candi Pamotan 2, Pamotan, Kec. Porong, Kabupaten Sidoarjo, Jawa Timur 61274"
ChIJKSiA9MH91y0RrNoUp7sugrg,Wisata Batas Kampung,https://www.google.com/maps/place/Wisata+Batas+Kampung/data=!4m7!3m6!1s0x2dd7fdc1f4802829:0xb8822ebba714daac!8m2!3d-7.3303813!4d112.6784212!16s%2Fg%2F11rbyhp_bz!19sChIJKSiA9MH91y0RrNoUp7sugrg?authuser=0&hl=id&rclk=1,Tujuan Wisata,Tujuan Wisata,4.4,274,"Wisata Batas Kampung, Jl. Sumberan HKSN 1, RT.002/RW.004, Balas Klumprik, Kec. Wiyung, Surabaya, Jawa Timur 60222"
ChIJ3059MjULeC4RbF_WDsBiSPo,Ekowisata Tirta Kanal Bengok,https://www.google.com/maps/place/Ekowisata+Tirta+Kanal+Bengok/data=!4m7!3m6!1s0x2e780b35327d4edf:0xfa4862c00ed65f6c!8m2!3d-7.5010866!4d112.6073718!16s%2Fg%2F11spjkt4gd!19sChIJ3059MjULeC4RbF_WDsBiSPo?authuser=0&hl=id&rclk=1,Tujuan Wisata,Tujuan Wisata,4.7,12,"Ekowisata Tirta Kanal Bengok, Tirta kanal, Bengok, Cangkring, Kec. Krembung, Kabupaten Sidoarjo, Jawa Timur 61275"
ChIJ4_esXSjj1y0Rqayqi7WIsfA,KP ASAL JAYA,https://www.google.com/maps/place/KP+ASAL+JAYA/data=!4m7!3m6!1s0x2dd7e3285dacf7e3:0xf0b188b58baaaca9!8m2!3d-7.42319!4d112.62743!16s%2Fg%2F11rv91t3hs!19sChIJ4_esXSjj1y0Rqayqi7WIsfA?authuser=0&hl=id&rclk=1,Tujuan Wisata,Tujuan Wisata,4.6,7,"HJGG+PXF KP ASAL JAYA, Kemalangan, Plaosan, Kec. Wonoayu, Kabupaten Sidoarjo, Jawa Timur 61261"
ChIJh46a3dEHeC4RniEAVZUFuYg,Wisata Bendungan Kesamben,https://www.google.com/maps/place/Wisata+Bendungan+Kesamben/data=!4m7!3m6!1s0x2e7807d1dd9a8e87:0x88b905955500219e!8m2!3d-7.3485337!4d112.6164794!16s%2Fg%2F11rmw8969s!19sChIJh46a3dEHeC4RniEAVZUFuYg?authuser=0&hl=id&rclk=1,Tujuan Wisata,Tujuan Wisata,3.7,3,"MJ28+HHQ Wisata Bendungan Kesamben, Dusun Tenaru, Tenaru, Kec. Driyorejo, Kabupaten Gresik, Jawa Timur 61177"
ChIJ7S8XH3Dh1y0RkkMNehFWs00,pacet,https://www.google.com/maps/place/pacet/data=!4m7!3m6!1s0x2dd7e1701f172fed:0x4db356117a0d4392!8m2!3d-7.4497718!4d112.7015495!16s%2Fg%2F11s84fsqq7!19sChIJ7S8XH3Dh1y0RkkMNehFWs00?authuser=0&hl=id&rclk=1,Tujuan Wisata,Tujuan Wisata,1,1,"HP22+3JV pacet, Jati, Kec. Sidoarjo, Kabupaten Sidoarjo, Jawa Timur"
ChIJefbSTnUJeC4Rkam76SJmhtE,GKS,https://www.google.com/maps/place/GKS/data=!4m7!3m6!1s0x2e7809754ed2f679:0xd1866622e9bba991!8m2!3d-7.4305064!4d112.5515542!16s%2Fg%2F11t5dwy_h0!19sChIJefbSTnUJeC4Rkam76SJmhtE?authuser=0&hl=id&rclk=1,Tujuan Wisata,Tujuan Wisata,1,1,"HH92+QJ GKS, Gagang I, Gagangkepuhsari, Kec. BalongBendo, Kabupaten Sidoarjo, Jawa Timur 61265"
ChIJKxJ6byvl1y0Rxv5k9egd1zk,SYARIF FARM,https://www.google.com/maps/place/SYARIF+FARM/data=!4m7!3m6!1s0x2dd7e52b6f7a122b:0x39d71de8f564fec6!8m2!3d-7.3583347!4d112.7785964!16s%2Fg%2F11j5b1kbdn!19sChIJKxJ6byvl1y0Rxv5k9egd1zk?authuser=0&hl=id&rclk=1,Tujuan Wisata,Tujuan Wisata,,,"SYARIF FARM, Jl. Tambak Rejo No.34, Tambak Kidul, Tambakrejo, Kec. Waru, Kabupaten Sidoarjo, Jawa Timur 61256"
ChIJDY5MKOPn1y0RaSj7HV3U6M0,Kebun binatang candi,https://www.google.com/maps/place/Kebun+binatang+candi/data=!4m7!3m6!1s0x2dd7e7e3284c8e0d:0xcde8d45d1dfb2869!8m2!3d-7.48857!4d112.716245!16s%2Fg%2F11svgg2y0x!19sChIJDY5MKOPn1y0RaSj7HV3U6M0?authuser=0&hl=id&rclk=1,Tujuan Wisata,Tujuan Wisata,,,"GP68+JGJ Kebun binatang candi, Jl. Kalasan II, Gelam, Kec. Candi, Kabupaten Sidoarjo, Jawa Timur 61271"
ChIJeWq33izj1y0RMzULYkUMPqo,Wisata JMT (Jembatan merah telenteyan,https://www.google.com/maps/place/Wisata+JMT+%28Jembatan+merah+telenteyan/data=!4m7!3m6!1s0x2dd7e32cdeb76a79:0xaa3e0c45620b3533!8m2!3d-7.3935725!4d112.6950871!16s%2Fg%2F11y1c099wk!19sChIJeWq33izj1y0RMzULYkUMPqo?authuser=0&hl=id&rclk=1,Tujuan Wisata,Tujuan Wisata,,,"Wisata JMT (Jembatan merah telenteyan, 2273+W2 Longos Telenteyan, RT.1/RW.7, Kabupaten Sumenep, Jawa Timur"
